5413,Gendarmes,209,158,51,1100155.1444514194,1222085.780245023,11.083040097440367
3521,Técnicos de radiodifusión y grabación audiovisual,191,160,31,732019.3398575835,823420.183565695,12.486124167961709
2145,Ingenieros químicos,151,71,80,1794453.9928704617,2021473.4189401646,12.65117004791836
8342,Operadores de máquinas de movimiento de tierras,1200,1171,29,915158.6238867999,1050679.3171310017,14.80843754371537
2131,"Biólogos, botánicos, zoólogos, genetista y farmacólogos",102,48,54,1355034.2838196286,1574729.0720654875,16.213227286513643
2146,Ingenieros en minas y metalúrgicos,291,250,41,2472103.4098955086,2891905.6757062147,16.981581924538112
1112,Personal directivo de la administración pública,183,113,70,2606554.122715635,3069820.616099071,17.773139231836943
2512,Desarrolladores de software,286,248,38,2039364.2620115436,2444003.6133993743,19.841445637019817
2643,"Traductores, intérpretes de lengua de señas y lingüistas",55,21,34,885577.7264705882,1206796.894293282,36.27227268947826
2652,"Músicos, cantantes y compositores",148,128,20,816954.3071831708,1151877.262087912,40.99653456256858
7313,"Joyeros, orfebres y plateros",124,50,74,421412.31202435313,668754.0348253392,58.693520749980465
