oficio4_08,nombre,n,n_h,n_m,ingreso_h,ingreso_m,brecha_pct
5142,Cosmetólogos y especialistas en tratamiento de belleza,685,25,660,1301886.5076948535,427652.13160960627,-67.15135082190722
6122,Avicultores y trabajadores calificados de la avicultura,106,76,30,645435.3822725498,281774.2325428195,-56.34354107599358
1219,"Otros directores, gerentes y administradores de servicios administrativos no clasificados previamente",62,42,20,2815188.809246309,1258622.8414179105,-55.291707707701754
1411,"Directores, gerentes y administradores de hoteles",144,51,93,1910164.8261958428,864697.7667194301,-54.73177210358833
7514,"Operarios de la conservación de frutas, legumbres y verduras",59,23,36,569735.8006849315,260794.3056124539,-54.225396175046534
6130,Productores y trabajadores calificados de explotaciones agropecuarias mixtas,243,203,40,776335.1677089756,361340.0537313433,-53.455663383421694
7318,"Artesanos de los tejidos, el cuero y materiales similares",424,65,359,427900.1617722823,200537.2328746801,-53.13457418569498
4313,Empleados encargados de nóminas o registros de remuneraciones,91,22,69,1665827.0530023482,802551.9174831598,-51.82261471641327
1431,"Directores, gerentes y administradores de centros deportivos, de esparcimiento y culturales",75,52,23,1629842.4156529387,813070.9537572254,-50.11352349475471
3311,Agentes de bolsa y otros servicios financieros,109,37,72,2542082.205500382,1293721.849393677,-49.10778862326281
6123,Trabajadores calificados de la apicultura y la sericultura,105,81,24,611165.8099947944,313028.0824587706,-48.78180727069192
7319,Artesanos no clasificados previamente,276,62,214,522298.226039783,273576.51383201836,-47.62063124235457
6114,Agricultores y trabajadores calificados de cultivos mixtos,301,232,69,575068.2312386029,301446.1230305062,-47.580807518919876
1321,"Directores, gerentes y administradores de industrias manufactureras",421,310,111,2976219.951792046,1573612.286838124,-47.127150804475384
3251,Técnicos y auxiliares paramédicos en odontología,344,24,320,1097717.3853698405,587412.7170408317,-46.487800514982105
1420,"Directores, gerentes y administradores de comercios al por mayor y al por menor",1042,674,368,2298227.0718292817,1250226.1098694776,-45.600409759582384
3332,Organizadores de conferencias y eventos,173,97,76,1322833.1552612216,743538.2504546914,-43.79198559565406
9611,Recolectores de basura y material reciclable,280,240,40,435269.7298458741,247943.02421608198,-43.03692464351316
7322,Impresores,206,118,88,658597.4037572597,377286.9728694542,-42.71356511321574
5243,Representantes de ventas de puerta a puerta (venta a hogares),390,86,304,405139.80393996247,232177.24374849102,-42.69206790086286
1221,"Directores, gerentes y administradores comercialización",113,79,34,4055593.993356708,2344621.473986152,-42.18796364165706
7513,Operarios de la elaboración de productos lácteos,69,34,35,580399.9730297723,335839.29557069845,-42.13657629624473
7533,Costureros y bordadores,589,39,550,375824.05281779123,217841.17197478138,-42.03639433360159
5244,Vendedores por internet y otros medios de comunicación,688,144,544,674147.4140854753,394625.7923353578,-41.462982117836454
4120,Secretarios generales,695,38,657,1004208.444262742,590489.4453303913,-41.19851822557518
6111,Agricultores y trabajadores calificados de cultivos extensivos,1504,1243,261,526971.4619351319,311622.01075179194,-40.86548641411034
6222,Pescadores en agua dulce y en aguas costeras,590,567,23,586059.7304557803,346722.9837037037,-40.83828564128502
7512,"Panaderos, pasteleros y confíteros",2164,767,1397,564132.1424449641,341379.13333448744,-39.48596301303788
1342,"Directores, gerentes y administradores de servicios de salud",140,46,94,3758197.7744742567,2288654.4971217103,-39.10234015180652
1439,"Directores, gerentes y administradores de otros servicios no clasificados previamente",463,307,156,2657108.8051532777,1676762.64418811,-36.89522081534089
1412,"Directores, gerentes y administradores de restaurantes",685,326,359,1324728.3627458583,843054.4368086609,-36.360203305287264
5249,Otros vendedores no clasificados previamente,510,198,312,821516.3578232533,523375.91894024063,-36.29147929238879
9520,Vendedores ambulantes (excluyendo comida de consumo inmediato),1045,464,581,386949.4145759108,250588.50143283463,-35.23998435106178
5211,Vendedores en quioscos o puestos de feria,2686,905,1781,363387.2751729439,237390.03373024857,-34.67299216317647
1346,"Directores, gerentes y administradores de servicios financieros",108,64,44,4293522.55951586,2818541.4697011244,-34.353635490878965
5221,"Comerciantes y dueños - operadores de locales comerciales, tiendas, almacenes y mercados",4711,1941,2770,707211.6578957404,471962.37067495694,-33.264339550164024
2163,Diseñadores de productos y de vestuario,115,35,80,1183446.870630699,790573.2814588505,-33.19739980912475
2245,Dietistas y nutricionistas,245,22,223,1688405.5078097882,1129362.8973646169,-33.11068388839631
3434,Chefs,249,160,89,915464.1495231108,618943.98385795,-32.39014502311488
9312,Obreros de obras públicas,593,573,20,575585.1990094656,390343.5004248088,-32.183193539973296
3312,Ejecutivos de préstamos y créditos,277,104,173,1953593.4310668563,1329933.5986037673,-31.923726940590125
5141,Peluqueros,1123,322,801,625595.252170668,431925.6396357701,-30.957653828559273
7531,"Sastres, modistos, peleteros y sombrereros",402,46,356,452049.8683221696,312148.48936296825,-30.948218053565625
3354,Agentes de servicios de tramitación y entrega de licencias y permisos,51,20,31,1152782.8576709796,803128.0259608901,-30.33136981378377
1345,"Directores, gerentes y administradores de servicios de educación",387,135,252,2346738.968905012,1637283.5624415604,-30.231543254871816
6121,Criadores de ganado,1017,904,113,621075.4911722462,438506.2500478652,-29.39566022478064
3422,"Entrenadores, instructores y árbitros de actividades deportivas",272,201,71,751961.3689895069,538029.496158574,-28.449848842423464
2248,Terapeutas ocupacionales,220,32,188,1400634.0637027207,1003768.3944624766,-28.334714935540607
2513,Desarrolladores web y multimedia,98,78,20,1762048.538729667,1265153.856618771,-28.199829413843936
2143,Ingenieros mediambientales,111,66,45,2072922.9886060357,1506351.8234384065,-27.33199295303428
2424,Especialistas en formación del personal,60,26,34,1520369.2033018868,1107358.2705244124,-27.16517355656186
4214,Cobradores,189,53,136,1013651.1740853256,739743.6901484613,-27.021868167224927
2412,Asesores financieros y en inversiones,112,62,50,2812914.446022727,2056985.1772970285,-26.87352506559636
2355,otros profesores de artes,72,20,52,751458.2232109752,549690.0346598203,-26.85022032083181
3512,Técnicos en asistencia al usuario de tecnología de la información y las comunicaciones,115,92,23,1059694.0160048069,778264.3502097065,-26.55763470818956
3412,Técnico en trabajo social,169,30,139,862886.6519434629,635155.7329612718,-26.391753594667065
7314,"Alfareros (barro, arcilla y abrasivos)",76,39,37,356758.38108231017,263847.22911497107,-26.043158870009265
2161,Arquitectos,382,238,144,2154720.2839227878,1594495.3861885928,-25.999889726488046
2659,Otros artistas creativos e interpretativos no clasificados previamente,72,42,30,650950.746703678,481742.13652655587,-25.994072675078794
5212,Vendedores ambulantes de productos comestibles de consumo inmediato (elaboración propia),431,119,312,391788.1419453108,290031.7653589136,-25.97229617036273
5120,Cocineros,3401,703,2698,674204.4568669476,499886.03048741375,-25.855424805347305
9216,Obreros de pesca y acuicultura,600,411,189,541722.4922250122,402220.52775467775,-25.75155480389215
4311,Auxiliares y ayudantes de registros de contabilidad y cálculo de costos,244,89,155,865591.9269220133,642861.5518677775,-25.731567974097224
3342,Secretarios jurídicos,111,28,83,1223926.1116546763,911860.4028403967,-25.497103611294392
7543,"Clasificadores, probadores de productos e inspectores de calidad (excluyendo alimentos y bebidas)",128,76,52,886032.9622277068,660369.1277315663,-25.469011212490965
2230,Veterinarios,271,119,152,1565756.4824530557,1170181.9698268846,-25.26411463463516
7233,Mecánicos y reparadores de máquinas agrícolas e industriales,1349,1316,33,881944.162494521,662253.8763578275,-24.909772690746546
1323,"Directores, gerentes y administradores de construcción",350,312,38,3027889.095790826,2274255.71902834,-24.88972855082895
3423,Instructores de acondicionamiento físico y actividades recreativas,201,118,83,799305.3029458299,602587.8201545464,-24.6110568848078
1311,"Directores, gerentes y administradores de producción y operaciones agropecuarias y de silvicultura",356,293,63,2547493.926763148,1920660.9070326588,-24.60586905213724
3351,Inspectores de aduana,54,33,21,1288918.7331722472,973675.386429458,-24.45796919771054
5223,"Vendedores y asistentes de venta de tiendas, almacenes y puestos de mercado",6358,2214,4144,681594.9722936406,515199.54561812547,-24.41265464672906
6210,Trabajadores forestales calificados,615,576,39,501170.0236229319,379491.3982836951,-24.27891126840117
3123,Supervisores de la construcción,579,541,38,1173125.1563683413,892315.4129881155,-23.93689555251992
2243,Ingenieros en prevención de riesgos y otros profesionales de la seguridad e higiene laboral y ambiental,801,481,320,1650680.8575115965,1261686.7760404302,-23.565674715436845
3343,Secretarios administrativos y ejecutivos,2271,430,1841,1020406.844431303,780336.1281096298,-23.5269606071165
3215,Laboratoristas dentales o técnicos en prótesis dentales,62,32,30,1009319.3179012346,777587.5330839374,-22.959214265229487
7522,Ebanistas y mueblistas,706,656,50,518401.06096969044,399750.37304305285,-22.887817340631322
2141,Ingenieros industriales y de producción,474,369,105,2347840.857571613,1815769.601580918,-22.66215166478616
4227,"Entrevistadores de investigaciones de mercado, estudios de opinión pública y encuestadores",74,21,53,983231.7312339803,761040.9033078881,-22.598012337054783
8183,"Operadores de máquinas de embalaje, embotellamiento y etiquetado",290,141,149,687647.3709349594,534069.956389518,-22.333745613922716
2114,Geólogos y geofísicos,84,57,27,2691013.3449819493,2098633.6443472407,-22.013257635431096
3118,Delineantes y dibujantes técnicos,126,94,32,1061340.1617826123,828717.8002286367,-21.91779506047018
5412,Carabineros,581,475,106,1157629.9478940063,904277.219331481,-21.885467719924822
5321,Trabajadores de los cuidados personales en instituciones,243,49,194,618747.414031358,483439.3798376856,-21.868056516324287
7515,"Catadores, clasificadores y controladores de calidad de alimentos y bebidas",275,102,173,761365.8233441034,595577.1497395834,-21.775166223818132
2651,Artistas de artes plásticas,104,44,60,633499.706539075,496810.70308568404,-21.576806120423964
6112,Agricultores y trabajadores calificados de plantaciones de árboles y arbustos,847,690,157,644243.7219376646,506975.61100066267,-21.306860472640132
5222,"Supervisores de locales comerciales, tiendas y almacenes",703,293,410,1055651.036564559,834072.4601699415,-20.989755962889788
9333,Obreros de carga,1001,960,41,498165.17813917535,393634.64015817223,-20.98310812720029
2132,Agrónomos y profesionales del ámbito forestal y pesquero,346,241,105,1885007.8643761303,1493876.340336543,-20.74959640388756
5246,Vendedores de comida al mostrador,267,94,173,521770.5902840675,414797.62392127974,-20.501915660778902
2212,Médicos especialistas,388,213,175,4894792.165631992,3897018.97375,-20.384383199918034
5312,Asistentes de aulas e inspectores de patio,1440,242,1198,623110.9611323928,496423.84005212766,-20.33139023104872
2433,Profesionales de ventas técnicas y médicas (excluyendo las TIC),116,81,35,2156141.0047938637,1725152.831029663,-19.988867741300854
3257,Inspectores de la salud y técnicos en prevención de riesgos,194,97,97,1007163.0161861406,806575.360188661,-19.916106208610785
4221,Empleados de agencias de viajes,121,23,98,1160004.356633381,930742.5428385098,-19.763875237524587
2422,Especialistas en políticas de administración,518,250,268,1689189.657362936,1360386.6123770068,-19.465134868232457
2413,Analistas financieros,139,66,73,2090525.1415815463,1683661.1183902412,-19.46228797246131
3435,Tatuadores,90,67,23,663310.6778634898,535254.5013850415,-19.305610591241297
3111,Técnicos en ciencias físicas y químicas,119,71,48,954246.9297826606,770941.1453005928,-19.209470710460398
1211,"Directores, gerentes y administradores de finanzas",116,59,57,3281642.3171275193,2654948.7656981037,-19.09694874906329
9510,Trabajadores ambulantes de servicios,110,88,22,246623.0760007927,199768.81188118813,-18.998329304535144
4415,Empleados administrativos de archivos,92,39,53,634103.5409506116,513700.1571565802,-18.987969001644366
8157,Operadores de máquinas de lavanderías,142,37,105,513238.454607978,417876.0323656578,-18.580529456850613
3344,Secretarios médicos,575,63,512,767555.9794144556,627511.4479041684,-18.245513717074136
3122,Supervisores de industrias manufactureras,278,220,58,1175465.3620467365,962240.6461862061,-18.139600089045636
1324,"Directores, gerentes y administradores de empresas de abastecimiento, almacenamiento y distribución",273,211,62,2517734.358111609,2063117.2524187546,-18.05659537624268
8131,Operadores de plantas y máquinas para fabricar productos químicos,110,88,22,738800.4939626784,605928.793997669,-17.984787645759425
2310,Profesores de la educación superior,968,518,450,1742050.2620877516,1430239.9239474721,-17.89904372601695
2353,Otros profesores de idiomas,73,25,48,671023.6032967033,551085.7818436313,-17.873860302949684
5151,"Supervisores de mantenimiento y limpieza en oficinas, hoteles y otros establecimientos",205,97,108,871815.7130714016,716987.8941185937,-17.759237030421303
9411,Cocineros de comida rápida,735,258,477,503709.50881050894,414901.44943820225,-17.630808594823545
3321,Agentes de seguros y ejecutivos de fondos de pensiones,368,102,266,1580603.2745499182,1303135.4677968747,-17.554550924997503
5132,bármanes,214,130,84,649516.9516490354,535560.4129353234,-17.54481363794922
9112,"Auxiliares de aseo de oficinas, hoteles y otros establecimientos",5980,1356,4624,531211.7147459097,438183.9061547669,-17.512378964692076
3313,Técnicos y asistentes en contabilidad,771,268,503,960326.3473710364,792618.9137962457,-17.463587668286106
9623,Recolectores de dinero en máquinas expendedoras de venta automática y lectores de medidores,108,79,29,562750.0691686948,465060.606029106,-17.35929829096201
2246,Fonoaudiólogos,246,27,219,1144812.4303106633,946832.5758068891,-17.293649969370893
1330,"Directores, gerentes y administradores de servicios de tecnología de la información y las comunicaciones",175,138,37,3820327.5498082233,3176908.9691031496,-16.84197421075512
9122,Limpiadores de vehículos,231,210,21,420213.1655960661,349789.83274647885,-16.758954410600822
3323,Agentes responsables de adquisiciones,437,229,208,1234966.9369845854,1029746.5645032051,-16.617479086724874
3411,Técnicos de los servicios jurídicos,230,79,151,1194343.1315735416,1004228.6295575451,-15.917913118110494
3355,Inspectores y detectives de la Policía de Investigaciones (PDI),119,85,34,1930763.6584831614,1630951.269875376,-15.52817649589089
5113,Guías de turismo,138,84,54,889179.7206055509,751229.5854761231,-15.51431414061948
4222,Empleados de centros de llamadas de informaciones,318,86,232,640835.4757368264,541714.7735028622,-15.467418079499451
4225,"Empleados de informaciones, reclamos o sugerencias",437,133,304,772936.6307871079,653522.6749985765,-15.449384986053516
4110,Trabajadores de tareas administrativas generales,1150,451,699,840787.4709989259,711376.1020270067,-15.391686179406028
2432,Profesionales de las relaciones públicas,121,47,74,1233400.897152891,1043681.8780945877,-15.381780530259004
4211,Cajeros de bancos y de oficinas de correo,130,33,97,826007.3135152697,699275.3323829367,-15.342719012135008
2244,Kinesiólogos,458,216,242,1268382.556110816,1074998.4307373432,-15.246514108995468
2511,Analistas de sistemas,484,408,76,1780544.61659253,1517937.6957349896,-14.748685228685666
5322,Trabajadores de los cuidados personales a domicilio,1042,35,1007,469778.0221594612,401525.68640735024,-14.528635341085295
3334,Agentes inmobiliarios,519,232,287,1221734.7966603506,1045361.3601276919,-14.436311138455004
2142,"Ingenieros civiles, ingenieros en construcción y constructores civiles",834,677,157,2027446.624316561,1739865.373984657,-14.184405492245489
5245,Bomberos de gasolineras,357,302,55,561513.5774250311,482088.9048539,-14.144746585711054
1349,"Directores, gerentes y administradores de otros servicios profesionales no clasificados previamente",166,100,66,3266666.1470898814,2806383.348361608,-14.090291998106919
8160,"Operadores de máquinas para elaborar alimentos, bebidas y cigarrillos",691,489,202,703063.3068771247,607228.9019270331,-13.630978037492824
2241,Dentistas,336,144,192,2115898.7362477584,1827761.6087954717,-13.617718207217056
2411,Contadores,1401,615,786,1576026.8199301457,1362285.874135103,-13.562011958940923
3221,Técnicos y auxiliares paramédicos de enfermería,2599,420,2179,773912.4628635598,669538.4382347005,-13.486541390309725
4412,Carteros y empleados de servicios de correos y encomiendas,133,97,36,727525.4247028332,629502.8206340378,-13.473426596580307
5131,Garzones de mesa,1326,450,876,565035.6703982817,489233.5630766968,-13.415455216863304
5230,Vendedores de entrada (entretenciones y eventos deportivos) y cajeros de comercio,2064,318,1746,535527.6932250387,465423.4254084226,-13.090689557889402
3322,"Representantes comerciales (excepto venta de productos y servicios industriales, farmacéuticos y de tecnologías de la información y las comunicaciones)",534,333,201,1286337.720598062,1119281.6355949265,-12.986953762458697
9613,Barrenderos,463,258,205,444149.02048631053,387174.75075290404,-12.827737337127044
2359,Otros profesionales de la educación no clasificados previamente,649,179,470,932269.1290862034,813140.904611202,-12.778308404545069
9334,Reponedores de estanterías,1595,712,883,496301.65641942684,436055.87629945314,-12.138943995193863
2421,Especialistas y asesores de gestión,416,230,186,2073423.6679902433,1828954.6122083317,-11.790598301546062
2211,Médicos generales,343,171,172,3164641.7476157416,2792769.0541766994,-11.750862280674045
4323,Empleados de servicios de transporte,466,314,152,884420.584254181,780997.3278910762,-11.693899735533641
4132,Digitadores de datos,105,36,69,767337.2085044697,677627.3284840245,-11.691063462866424
2431,Profesionales de la publicidad y la comercialización,375,192,183,1840016.7482731945,1626179.5231497418,-11.62148253944607
4212,Receptores de apuestas,54,25,29,617051.5562700965,546987.8410404624,-11.35459663259738
3333,Agentes de empleo y contratistas de personal,108,80,28,1103398.4909915284,981484.5055256446,-11.048953434432395
7131,Pintores y empapeladores de paredes,767,730,37,516542.41059610824,459704.7525394424,-11.003483332776721
8322,"Conductores de automóviles, taxis y camionetas",4481,3989,492,606939.5457162233,540207.4103476661,-10.994857039642959
4419,Otro personal de apoyo administrativo no clasificado previamente,419,178,241,884386.1429301533,787617.5519682554,-10.941893621408816
9412,Ayudantes de cocina,1138,281,857,502725.07156922144,449393.3875196917,-10.608518863612382
3212,Técnicos de laboratorios clínicos y servicios de sangre,117,21,96,749313.963155787,670546.1351351351,-10.51199255501869
3431,Fotógrafos,104,69,35,1107513.301378647,993761.6563896337,-10.27090553652168
4224,Recepcionistas de hoteles,200,82,118,613563.908045977,550768.7497990584,-10.234493493416675
1212,"Directores, gerentes y administradores de recursos humanos",241,96,145,2025971.087605451,1818994.9466113416,-10.216144853219012
4416,Empleados y asistentes de recursos humanos,403,137,266,895229.1682623884,808423.0568542896,-9.696524028209087
9621,"Mensajeros, estafetas, maleteros y repartidores de folletos y diarios a domicilio",379,269,110,552997.0700117388,499453.63606426504,-9.682408253327123
9211,Obreros de explotaciones agrícolas,6203,4017,2186,446555.78866689577,403560.9391378018,-9.628102606719436
5242,Promotores de tiendas,140,30,110,575692.5436746988,520795.52988255763,-9.535821576171276
4321,Empleados encargados del control de abastecimiento e inventario,2604,2052,552,707658.0636352894,640384.5101691287,-9.506505602518223
2247,Tecnólogos médicos,250,99,151,1567914.149258998,1428372.1547619049,-8.899849176247388
7115,Carpinteros de obra,2867,2834,33,544555.160354527,498343.90055116225,-8.48605672440591
2352,Educadores para necesidades especiales,697,35,662,1084473.0926587847,992779.3795182469,-8.45513952916378
9321,Empacadores manuales,485,214,271,571410.8708761032,523755.4647025382,-8.339954418525208
2634,Psicólogos,1016,289,727,1370595.5241400262,1257194.794444182,-8.27382898152954
5153,Conserjes,770,618,152,525905.932394273,483432.41308113036,-8.076257881285908
4226,Recepcionistas (funciones generales),244,59,185,592204.4530077752,545572.3351151122,-7.874327465087594
6113,"Agricultores y trabajadores calificados de huertas, invernaderos, viveros y jardines",1885,1492,393,459707.8848820565,423641.1865065593,-7.845568797400659
5414,Guardias de seguridad,3956,3179,777,587645.7971634177,542789.8877239034,-7.63315413060639
3259,Otros técnicos de la salud no clasificados previamente,80,32,48,709359.5391776571,655385.4775021026,-7.6088441325713685
5164,Cuidadores de animales,263,165,98,548385.4600636943,508768.5906661184,-7.224274216346727
3341,Supervisores de oficina,146,67,79,1159888.9782927851,1077179.8302608104,-7.130781443730283
2519,Otros desarrolladores y analistas de software y multimedia no clasificados previamente,169,134,35,2048960.0049567185,1904928.7056094476,-7.029483201177145
3121,Supervisores de minas,290,270,20,1718297.0614001772,1606895.7814814814,-6.48323752750406
2635,Profesionales del trabajo social,1153,183,970,1164476.2788956936,1098442.4357266875,-5.670690280752466
8321,Conductores de motocicletas,372,321,51,563549.9846822561,532867.8520252025,-5.444438557540376
3112,Técnicos en construcción y topógrafos,413,372,41,1035916.2995746119,979553.1059824652,-5.440902282867032
2611,Abogados,912,481,431,2346204.5760173504,2219064.67238179,-5.41896068804788
3142,Técnicos agropecuarios (incluyendo acuícolas),228,155,73,893726.0771766695,845719.0883755042,-5.371555113712468
9214,Ayudantes de jardinería y horticultura,138,95,43,374472.79624904314,354545.0561279826,-5.321545468901723
2632,"Sociólogos, antropólogos, geógrafos y arqueólogos",149,78,71,1759542.8018174309,1673828.8059833252,-4.871378846003161
8344,Operadores de autoelevadoras y montacargas,639,612,27,671553.2392717046,640439.073922734,-4.633164361281872
2330,Profesores de educación media,1099,480,619,1204168.14752236,1148761.4959014466,-4.601238766771543
8172,Operadores de instalaciones de procesamiento de la madera,390,361,29,579254.5306588148,553054.6740112994,-4.523030077592494
7511,Carniceros y pescaderos,791,472,319,560692.0586467944,536094.9399742984,-4.386921179490244
2242,Químicos farmaceúticos,182,69,113,2044415.4455927052,1956012.0065818666,-4.324142590558888
2423,Especialistas en políticas y servicios de personal,361,143,218,1584007.5750581345,1521052.2158993892,-3.974435485665828
9111,Trabajadores de casa particular y asistentes domésticos,4939,75,4864,390550.25696553546,376029.0872306463,-3.7181308873573737
3359,Agentes de la administración pública para la aplicación de la ley no clasificados previamente,217,143,74,1404649.6228636994,1354587.7198598504,-3.5640135581844534
2221,Enfermeros profesionales,1142,183,959,1513088.2044528185,1460704.914542504,-3.4620116498269904
7317,"Artesanos en madera, cestería y materiales similares",190,129,61,320925.4161249636,312223.87714932126,-2.711389792902563
3331,Agentes de aduana,182,97,85,1040107.5625436758,1018121.2501875067,-2.113849869757667
2113,Químicos,52,29,23,1392290.6939169618,1375371.6166166167,-1.2151971836245057
2341,Profesores de educación básica,2568,717,1851,1050528.507295903,1038074.0372662136,-1.1855432711433744
2149,Otros ingenieros no clasificados previamente,993,593,400,1962582.2372822368,1951144.6558763178,-0.5827822747319744
9629,Otras ocupaciones elementales no clasificadas previamente,171,120,51,431278.89558811754,430076.8427545985,-0.2787182136236632
9215,Obreros forestales,495,472,23,388437.86075715604,389243.3368121442,0.20736291087024572
8331,Conductores de buses y trolebuses,1320,1241,79,710825.7096319108,725267.3811359257,2.0316754597260234
7231,Mecánicos y reparadores de vehículos de motor,2563,2525,38,668999.9987457216,690005.732547799,3.13987052936624
9329,Obreros de la industria manufacturera no clasificados previamente,87,66,21,513413.883222924,529700.8308668076,3.172284228397415
2642,Periodistas,317,165,152,1632228.3465712979,1684401.2229482727,3.196420187565696
2320,Profesores de educación media técnico profesional (especialidades) y de formación laboral,101,56,45,971148.0262933242,1013762.6420787929,4.3880659417205425
5152,"Amas de llaves, mayordomos domésticos y dueños/administradores de pequeños establecimientos de alojamiento",225,128,97,681165.4075017568,715372.8416230367,5.021898314939266
2351,Especialistas en métodos pedagógicos,388,130,258,1492316.4878906,1568075.3319718107,5.076593651276773
6221,Trabajadores de explotaciones de acuicultura,200,146,54,813610.0842835895,855701.7810094098,5.173448257205848
3213,Técnicos y asistentes farmacéuticos,89,28,61,686286.1217694994,726803.594720239,5.903874734676351
9313,Obreros de la construcción de edificios,1807,1736,71,480504.77734313975,512085.0199515197,6.572305645533194
8332,Conductores de camiones pesados y de alto tonelaje,3975,3891,84,775631.1074409754,827133.441278845,6.640055220037544
9612,Clasificadores de desechos,119,95,24,300250.3360746164,329225.29229041917,9.650266039536447
2166,Diseñadores gráficos y de multimedia,433,240,193,978981.7562273635,1081419.4148451241,10.463694340180329
